[
  {
    "id": "gempack_pinch",
    "gems": 10,
    "usdList": 0.99,
    "usdPromo": 0.49,
    "sku": "skyhopper.gems.pinch",
    "badge": ""
  },
  {
    "id": "gempack_handful",
    "gems": 20,
    "usdList": 1.99,
    "usdPromo": 0.99,
    "sku": "skyhopper.gems.handful",
    "badge": ""
  },
  {
    "id": "gempack_pouch",
    "gems": 50,
    "usdList": 3.99,
    "usdPromo": 1.99,
    "sku": "skyhopper.gems.pouch",
    "badge": ""
  },
  {
    "id": "gempack_sack",
    "gems": 100,
    "usdList": 7.99,
    "usdPromo": 3.99,
    "sku": "skyhopper.gems.sack",
    "badge": "popular"
  },
  {
    "id": "gempack_chest",
    "gems": 200,
    "usdList": 11.99,
    "usdPromo": 5.99,
    "sku": "skyhopper.gems.chest",
    "badge": ""
  },
  {
    "id": "gempack_vault",
    "gems": 500,
    "usdList": 19.99,
    "usdPromo": 9.99,
    "sku": "skyhopper.gems.vault",
    "badge": ""
  },
  {
    "id": "gempack_treasury",
    "gems": 1000,
    "usdList": 29.99,
    "usdPromo": 14.99,
    "sku": "skyhopper.gems.treasury",
    "badge": "best_value"
  }
]
